tweet_id,in_reply_to_status_id,in_reply_to_user_id,timestamp,source,text,expanded_urls,rating_numerator,rating_denominator,name,favorite_count,retweet_count,tweet_length,jpg_url,img_num,p1,p1_conf,p1_dog,p2,p2_conf,p2_dog,p3,p3_conf,p3_dog,dogscription
679854723806179328,NaN,NaN,2015-12-23 22:42:51,iPhone,This is Bruce. He's a rare pup. Covered in Frosted Flakes. Nifty gold teeth. Overall good dog. 7/10 would pet firmly https://t.co/RtxxACzZ8A,https://twitter.com/dog_rates/status/679854723806179328/photo/1,7,10,Bruce,3017,1333,140,https://pbs.twimg.com/media/CW9UQ7oWkAAErmU.jpg,1,llama,0.887963,False,ram,0.0950207,False,chow,0.00230739,True,
679844490799091713,NaN,NaN,2015-12-23 22:02:12,iPhone,This is Willie. He's floating away and needs your assistance. Please someone help Willie. 10/10 https://t.co/MJqygWqt8X,https://twitter.com/dog_rates/status/679844490799091713/photo/1,10,10,Willie,2495,828,119,https://pbs.twimg.com/media/CW9K9VeVAAE0j-x.jpg,1,Airedale,0.903832,True,Border terrier,0.0347126,True,toy poodle,0.021378,True,
679828447187857408,NaN,NaN,2015-12-23 20:58:27,iPhone,Everybody look at this beautiful pupper 13/10 https://t.co/hyAC5Hq9GC,"https://twitter.com/dog_rates/status/679828447187857408/photo/1,https://twitter.com/dog_rates/status/679828447187857408/photo/1,https://twitter.com/dog_rates/status/679828447187857408/photo/1",13,10,,38209,15126,69,https://pbs.twimg.com/media/CW88XN4WsAAlo8r.jpg,3,Chihuahua,0.346545,True,dalmatian,0.166246,True,toy terrier,0.117502,True,pupper
679777920601223168,NaN,NaN,2015-12-23 17:37:40,iPhone,This is Rinna. She's melting. 10/10 get inside pupper https://t.co/PA0czwucsb,https://twitter.com/dog_rates/status/679777920601223168/photo/1,10,10,Rinna,3241,1205,77,https://pbs.twimg.com/media/CW8OYajUMAAPRoF.jpg,1,bloodhound,0.5288189999999999,True,bull mastiff,0.420119,True,French bulldog,0.00948059,True,pupper
679736210798047232,NaN,NaN,2015-12-23 14:51:56,iPhone,This pup's name is Sabertooth (parents must be cool). Ears for days. Jumps unannounced. 9/10 would pet diligently https://t.co/iazoiNUviP,https://twitter.com/dog_rates/status/679736210798047232/photo/1,9,10,Sabertooth,2200,858,137,https://pbs.twimg.com/media/CW7oelWWcAAhyzz.jpg,1,French bulldog,0.319139,True,Chihuahua,0.154088,True,Cardigan,0.117688,True,
679729593985699840,NaN,NaN,2015-12-23 14:25:38,iPhone,This is Hunter. He was playing with his ball minding his own business. Has no idea what happened to the carpet. 8/10 https://t.co/DbUTDI3u1R,https://twitter.com/dog_rates/status/679729593985699840/photo/1,8,10,Hunter,2279,884,140,https://pbs.twimg.com/media/CW7iddWUsAElUC0.jpg,1,wallaby,0.164215,False,West Highland white terrier,0.0935148,True,ashcan,0.0672783,False,
679722016581222400,NaN,NaN,2015-12-23 13:55:32,iPhone,This is Mike. He is a Jordanian Frito Pilates. Frowning because he can't see directly in front of him. 8/10 https://t.co/NL5QJwdEpF,https://twitter.com/dog_rates/status/679722016581222400/photo/1,8,10,Mike,1741,508,131,https://pbs.twimg.com/media/CW7bkW6WQAAksgB.jpg,1,boxer,0.459604,True,Boston bull,0.197913,True,French bulldog,0.0870225,True,
679530280114372609,NaN,NaN,2015-12-23 01:13:38,iPhone,Guys this really needs to stop. We've been over this way too many times. This is a giraffe. We only rate dogs.. 7/10 https://t.co/yavgkHYPOC,https://twitter.com/dog_rates/status/679530280114372609/photo/1,7,10,,5021,2235,140,https://pbs.twimg.com/media/CW4tL1vWcAIw1dw.jpg,1,dalmatian,0.750256,True,jaguar,0.169007,False,zebra,0.00648149,False,
679511351870550016,NaN,NaN,2015-12-22 23:58:25,iPhone,Say hello to William. He makes fun of others because he's terrified of his own deep-seated insecurities. 7/10 https://t.co/bwuV6FlRxr,https://twitter.com/dog_rates/status/679511351870550016/photo/1,7,10,William,3550,1377,133,https://pbs.twimg.com/media/CW4b-GUWYAAa8QO.jpg,1,Chihuahua,0.761972,True,black-footed ferret,0.150605,False,squirrel monkey,0.028147900000000007,False,
679475951516934144,NaN,NaN,2015-12-22 21:37:45,iPhone,This is Evy. She doesn't want to be a Koala. 9/10 https://t.co/VITeF0Kl9L,https://twitter.com/dog_rates/status/679475951516934144/photo/1,9,10,Evy,2208,687,73,https://pbs.twimg.com/media/CW37xZbUoAAUXe5.jpg,1,Maltese dog,0.145742,True,toy poodle,0.139407,True,West Highland white terrier,0.108821,True,
679462823135686656,NaN,NaN,2015-12-22 20:45:35,iPhone,Meet Hurley. He's the curly one. He hugs every other dog he sees during his walk. 11/10 for spreading the love https://t.co/M6vqkt2GKV,https://twitter.com/dog_rates/status/679462823135686656/photo/1,11,10,Hurley,33438,20292,134,https://pbs.twimg.com/media/CW3v1KxW8AAIOuy.jpg,1,toy poodle,0.62178,True,miniature poodle,0.197819,True,soft-coated wheaten terrier,0.046745,True,
679158373988876288,NaN,NaN,2015-12-22 00:35:49,iPhone,This is Rubio. He has too much skin. 11/10 https://t.co/NLOHmlENag,https://twitter.com/dog_rates/status/679158373988876288/photo/1,11,10,Rubio,22638,8735,66,https://pbs.twimg.com/media/CWza7kpWcAAdYLc.jpg,1,pug,0.27220500000000003,True,bull mastiff,0.25153000000000003,True,bath towel,0.116806,False,
679148763231985668,NaN,NaN,2015-12-21 23:57:37,iPhone,I know everyone's excited for Christmas but that doesn't mean you can send in reindeer. We only rate dogs... 8/10 https://t.co/eWjWgbOCYL,https://twitter.com/dog_rates/status/679148763231985668/photo/1,8,10,,2915,1108,137,https://pbs.twimg.com/media/CWzSMmAWsAAyB1u.jpg,1,Italian greyhound,0.302685,True,hair slide,0.124281,False,Afghan hound,0.059846,True,
679132435750195208,NaN,NaN,2015-12-21 22:52:45,iPhone,This is Louis. He's a river dancer. His friends think it's badass. All are very supportive. 10/10 for Louis https://t.co/qoIvjKMY58,https://twitter.com/dog_rates/status/679132435750195208/photo/1,10,10,Louis,3118,1244,131,https://pbs.twimg.com/media/CWzDWOkXAAAP0k7.jpg,1,Scottish deerhound,0.19461,True,Irish wolfhound,0.162855,True,giant schnauzer,0.15983699999999998,True,
679111216690831360,NaN,NaN,2015-12-21 21:28:25,iPhone,This is officially the greatest yawn of all time. 12/10 https://t.co/4R0Cc0sLVE,https://twitter.com/dog_rates/status/679111216690831360/video/1,12,10,,6264,2745,79,https://pbs.twimg.com/ext_tw_video_thumb/679111114081370114/pu/img/hFca8BHjRopgD0cM.jpg,1,kelpie,0.189423,True,beagle,0.121988,True,basset,0.121171,True,
679062614270468097,NaN,NaN,2015-12-21 18:15:18,iPhone,This is Chompsky. He lives up to his name. 11/10 https://t.co/Xl37lQEWd0,"https://twitter.com/dog_rates/status/679062614270468097/photo/1,https://twitter.com/dog_rates/status/679062614270468097/photo/1",11,10,Chompsky,17969,8837,72,https://pbs.twimg.com/media/CWyD2HGUYAQ1Xa7.jpg,2,cash machine,0.802333,False,schipperke,0.0455186,True,German shepherd,0.0233535,True,
679047485189439488,NaN,NaN,2015-12-21 17:15:11,iPhone,This dog doesn't know how to stairs. Quite tragic really. 9/10 get it together pup https://t.co/kTpr9PTMg1,https://twitter.com/dog_rates/status/679047485189439488/photo/1,9,10,,2369,734,106,https://pbs.twimg.com/media/CWx2FaLWcAEQ3vh.jpg,1,panpipe,0.962572,False,bannister,0.0252482,False,golden retriever,0.00293035,True,
678991772295516161,NaN,NaN,2015-12-21 13:33:48,iPhone,If your Monday isn't going so well just take a look at this. Both 12/10 https://t.co/GJT6SILPGU,https://twitter.com/dog_rates/status/678991772295516161/photo/1,12,10,,2440,1266,95,https://pbs.twimg.com/media/CWxDaXHWsAAWV8W.jpg,1,Eskimo dog,0.330216,True,Siberian husky,0.187003,True,Chihuahua,0.10142,True,
678969228704284672,NaN,NaN,2015-12-21 12:04:13,iPhone,Meet Lola. She's a Metamorphic Chartreuse. Plays with her food. Insubordinate and churlish. Exquisite hardwood 11/10 https://t.co/etpBNXwN7f,https://twitter.com/dog_rates/status/678969228704284672/photo/1,11,10,Lola,1724,497,140,https://pbs.twimg.com/media/CWwu6OLUkAEo3gq.jpg,1,Labrador retriever,0.680251,True,Chesapeake Bay retriever,0.201697,True,golden retriever,0.019675900000000003,True,
678800283649069056,NaN,NaN,2015-12-21 00:52:53,iPhone,Here's a pupper with some mean tan lines. Snazzy sweater though 12/10 https://t.co/DpCSVsl6vu,https://twitter.com/dog_rates/status/678800283649069056/photo/1,12,10,,2703,971,93,https://pbs.twimg.com/media/CWuVQSLW4AAI3w9.jpg,1,Labrador retriever,0.213673,True,beagle,0.146235,True,Airedale,0.122701,True,pupper
678798276842360832,NaN,NaN,2015-12-21 00:44:55,iPhone,This is Linda. She fucking hates trees. 7/10 https://t.co/blaY85FIxR,https://twitter.com/dog_rates/status/678798276842360832/photo/1,7,10,Linda,3659,1277,68,https://pbs.twimg.com/media/CWuTbAKUsAAvZHh.jpg,1,Airedale,0.583122,True,silky terrier,0.12956700000000002,True,Lakeland terrier,0.0947266,True,
678774928607469569,NaN,NaN,2015-12-20 23:12:08,iPhone,This is Tug. He's not required to wear the cone he just wants his voice to project more clearly. 11/10 https://t.co/Sp739Ou2qx,https://twitter.com/dog_rates/status/678774928607469569/photo/1,11,10,Tug,2931,993,126,https://pbs.twimg.com/media/CWt-MNIWEAAUC9S.jpg,1,Pembroke,0.194681,True,toy poodle,0.121821,True,Pomeranian,0.096843,True,
678764513869611008,NaN,NaN,2015-12-20 22:30:45,iPhone,"Meet Wilson. He got caught humping the futon. He's like ""dude, help me out here"" 10/10 I'd help Wilson out https://t.co/m6XoclB0qv",https://twitter.com/dog_rates/status/678764513869611008/photo/1,10,10,Wilson,1714,514,130,https://pbs.twimg.com/media/CWt0ubZWcAAkFER.jpg,1,Irish terrier,0.696646,True,Australian terrier,0.0749616,True,Irish setter,0.06390119999999999,True,
678755239630127104,NaN,NaN,2015-12-20 21:53:54,iPhone,This is Dash. He didn't think the water would be that cold. Damn it Dash it's December. Think a little. 10/10 https://t.co/NqcOwG8pxW,https://twitter.com/dog_rates/status/678755239630127104/photo/1,10,10,Dash,7503,3558,133,https://pbs.twimg.com/media/CWtsSQAUkAAnWws.jpg,1,malamute,0.606654,True,Border collie,0.193831,True,collie,0.0483781,True,
678740035362037760,NaN,NaN,2015-12-20 20:53:29,iPhone,Meet Tango. He's a large dog. Doesn't care much for personal space. Owner isn't very accepting. Tongue slip. 6/10 https://t.co/p2T5kGebxe,https://twitter.com/dog_rates/status/678740035362037760/photo/1,6,10,Tango,3944,1832,137,https://pbs.twimg.com/media/CWtede2WIAAF_AJ.jpg,1,seat belt,0.7871640000000001,False,sunglasses,0.045738699999999986,False,beagle,0.0225251,True,
678643457146150913,NaN,NaN,2015-12-20 14:29:43,iPhone,Meet Grizz. He just arrived. Couldn't wait until Christmas. Worried bc he saw the swastikas on the carpet. 10/10 https://t.co/QBGwYrT7rv,https://twitter.com/dog_rates/status/678643457146150913/photo/1,10,10,Grizz,2152,457,136,https://pbs.twimg.com/media/CWsGnyMVEAAM1Y1.jpg,1,Labrador retriever,0.33875700000000003,True,flat-coated retriever,0.30447,True,chest,0.0933923,False,
678446151570427904,NaN,NaN,2015-12-20 01:25:42,iPhone,Touching scene here. Really stirs up the emotions. The bond between father &amp; son. So beautiful. 10/10 for both pups https://t.co/AJWJHov5gx,https://twitter.com/dog_rates/status/678446151570427904/photo/1,10,10,,4195,1688,143,https://pbs.twimg.com/media/CWpTLOYWsAEDhcU.jpg,1,Staffordshire bullterrier,0.284492,True,Rottweiler,0.189434,True,American Staffordshire terrier,0.18943,True,
678424312106393600,NaN,NaN,2015-12-19 23:58:55,iPhone,This is Crystal. She's a shitty fireman. No sense of urgency. People could be dying Crystal. 2/10 just irresponsible https://t.co/rtMtjSl9pz,https://twitter.com/dog_rates/status/678424312106393600/photo/1,2,10,Crystal,5682,2732,140,https://pbs.twimg.com/media/CWo_T8gW4AAgJNo.jpg,1,Maltese dog,0.759945,True,toy poodle,0.101194,True,Shih-Tzu,0.0560374,True,
678410210315247616,NaN,NaN,2015-12-19 23:02:53,iPhone,Say hello to Jerome. He can shoot french fries out of his mouth at insane speeds. Deadly af. 10/10 https://t.co/dIy88HwrX8,https://twitter.com/dog_rates/status/678410210315247616/photo/1,10,10,Jerome,4441,1959,122,https://pbs.twimg.com/media/CWoyfMiWUAAmGdd.jpg,1,schipperke,0.145877,True,Labrador retriever,0.0983538,True,kelpie,0.0973934,True,
678399652199309312,NaN,NaN,2015-12-19 22:20:55,iPhone,This made my day. 12/10 please enjoy https://t.co/VRTbo3aAcm,https://twitter.com/dog_rates/status/678399652199309312/video/1,12,10,,81911,33900,60,https://pbs.twimg.com/ext_tw_video_thumb/678399528077250560/pu/img/BOjUNHRsYLeSo0hl.jpg,1,swing,0.929196,False,Bedlington terrier,0.0150472,True,Great Pyrenees,0.014038900000000002,True,
678396796259975168,NaN,NaN,2015-12-19 22:09:34,iPhone,These little fellas have opposite facial expressions. Both 12/10 https://t.co/LmThv0GWen,"https://twitter.com/dog_rates/status/678396796259975168/photo/1,https://twitter.com/dog_rates/status/678396796259975168/photo/1",12,10,,1668,451,88,https://pbs.twimg.com/media/CWomSU_XIAAUYiK.jpg,2,Pembroke,0.95618,True,Cardigan,0.0318031,True,Chihuahua,0.0062765,True,
678389028614488064,NaN,NaN,2015-12-19 21:38:42,iPhone,"This is Bella. She just learned that her final grade in chem was a 92.49 
poor pupper 11/10 https://t.co/auOoKuoveM",https://twitter.com/dog_rates/status/678389028614488064/photo/1,11,10,Bella,1961,452,115,https://pbs.twimg.com/media/CWofOHUWUAACGVa.jpg,1,miniature pinscher,0.516284,True,kelpie,0.227402,True,vizsla,0.103246,True,pupper
678380236862578688,NaN,NaN,2015-12-19 21:03:46,iPhone,This is Crumpet. He underestimated the snow. Quickly retreating. 10/10 https://t.co/a0Zx5LDFZa,https://twitter.com/dog_rates/status/678380236862578688/photo/1,10,10,Crumpet,2558,970,94,https://pbs.twimg.com/media/CWoXOfSUAAA4u8g.jpg,1,dogsled,0.08854,False,snowmobile,0.057291,False,Samoyed,0.0476014,True,
678341075375947776,NaN,NaN,2015-12-19 18:28:09,iPhone,This pupper likes tape. 12/10 https://t.co/cSp6w5GWgm,https://twitter.com/dog_rates/status/678341075375947776/photo/1,12,10,,1807,578,53,https://pbs.twimg.com/media/CWnznDTU4AAa-6P.jpg,1,golden retriever,0.853284,True,cocker spaniel,0.0262298,True,Labrador retriever,0.0241228,True,pupper
678334497360859136,NaN,NaN,2015-12-19 18:02:01,iPhone,This is Rosie. She has a snazzy bow tie and a fin for a tail. Probably super fast underwater. Cool socks 10/10 https://t.co/GO76MdGBs0,https://twitter.com/dog_rates/status/678334497360859136/photo/1,10,10,Rosie,1366,286,134,https://pbs.twimg.com/media/CWntoDVWcAEl3NB.jpg,1,Norfolk terrier,0.378643,True,golden retriever,0.0955939,True,kelpie,0.0853092,True,
678278586130948096,NaN,NaN,2015-12-19 14:19:51,iPhone,Another spooky pupper here. Most definitely floating. No legs. Probably knows some dark magic. 10/10 very spooked https://t.co/JK8MByRzgj,https://twitter.com/dog_rates/status/678278586130948096/photo/1,10,10,,12030,6511,137,https://pbs.twimg.com/media/CWm6xySUEAAqfFU.jpg,1,Maltese dog,0.897841,True,Lhasa,0.0357175,True,Tibetan terrier,0.017107499999999998,True,pupper
678255464182861824,NaN,NaN,2015-12-19 12:47:58,iPhone,This is Jessifer. She is a Bismoth Teriyaki. Flowers being attacked by hurricanes on bandana (rad). 9/10 stellar pup https://t.co/nZhmRwZzWv,https://twitter.com/dog_rates/status/678255464182861824/photo/1,9,10,Jessifer,1661,399,140,https://pbs.twimg.com/media/CWmlvxJU4AEAqaN.jpg,1,Chihuahua,0.613819,True,Yorkshire terrier,0.127931,True,Pomeranian,0.062124300000000014,True,
678021115718029313,NaN,NaN,2015-12-18 21:16:45,iPhone,This is Reese. He likes holding hands. 12/10 https://t.co/cbLroGCbmh,https://twitter.com/dog_rates/status/678021115718029313/photo/1,12,10,Reese,14427,6824,68,https://pbs.twimg.com/media/CWjQm5gXAAA9GkD.jpg,1,miniature pinscher,0.822048,True,Doberman,0.0960845,True,Rottweiler,0.032709300000000004,True,
677918531514703872,NaN,NaN,2015-12-18 14:29:07,iPhone,"""Everything looks pretty good in there. Make sure to brush your gums. Been flossing? How's school going?"" Both 10/10 https://t.co/lWL2IMJqLR",https://twitter.com/dog_rates/status/677918531514703872/photo/1,10,10,,1411,440,140,https://pbs.twimg.com/media/CWhzTbzWUAAEAUN.jpg,1,Eskimo dog,0.199347,True,dalmatian,0.153225,True,American Staffordshire terrier,0.107798,True,
677895101218201600,NaN,NaN,2015-12-18 12:56:01,iPhone,Guys this was terrifying. Really spooked me up. We don't rate ghosts. We rate dogs. Please only send dogs... 9/10 https://t.co/EJImi1udYb,https://twitter.com/dog_rates/status/677895101218201600/photo/1,9,10,,5055,2258,137,https://pbs.twimg.com/media/CWhd_7WWsAAaqWG.jpg,1,dalmatian,0.550702,True,kuvasz,0.0602264,True,Great Pyrenees,0.058631,True,
677700003327029250,NaN,NaN,2015-12-18 00:00:46,iPhone,This is Ralph. He's an interpretive dancer. 10/10 https://t.co/zoDdPyPFsa,https://twitter.com/dog_rates/status/677700003327029250/photo/1,10,10,Ralph,3557,1542,73,https://pbs.twimg.com/media/CWesj06W4AAIKl8.jpg,1,Siberian husky,0.120849,True,junco,0.0792056,False,malamute,0.0630875,True,
677698403548192770,NaN,NaN,2015-12-17 23:54:25,iPhone,This is Sadie. She got her holidays confused. 9/10 damn it Sadie https://t.co/fm7HxOsuPK,https://twitter.com/dog_rates/status/677698403548192770/photo/1,9,10,Sadie,1281,340,88,https://pbs.twimg.com/media/CWerGmOXAAAm6NY.jpg,1,Shih-Tzu,0.916645,True,Lhasa,0.057883400000000015,True,Pekinese,0.0201258,True,
677687604918272002,NaN,NaN,2015-12-17 23:11:30,iPhone,This was Cindy's face when she heard Susan forgot the snacks for after the kid's soccer game. 11/10 https://t.co/gzkuVGRgAD,https://twitter.com/dog_rates/status/677687604918272002/photo/1,11,10,,2593,902,123,https://pbs.twimg.com/media/CWehRdEWIAAySyO.jpg,1,Pembroke,0.573047,True,sunglasses,0.12675799999999998,False,golden retriever,0.108047,True,
677673981332312066,NaN,NaN,2015-12-17 22:17:22,iPhone,Endangered triangular pup here. Could be a wizard. Caught mid-laugh. No legs. Just fluff. Probably a wizard. 9/10 https://t.co/GFVIHIod0Z,https://twitter.com/dog_rates/status/677673981332312066/photo/1,9,10,,3501,1607,137,https://pbs.twimg.com/media/CWeU5LBWEAA8F0J.jpg,1,Maltese dog,0.817908,True,Angora,0.0778051,False,Pomeranian,0.0221842,True,
677644091929329666,NaN,NaN,2015-12-17 20:18:36,iPhone,This is a dog swinging. I really enjoyed it so I hope you all do as well. 11/10 https://t.co/Ozo9KHTRND,https://twitter.com/dog_rates/status/677644091929329666/video/1,11,10,,1966,851,103,https://pbs.twimg.com/ext_tw_video_thumb/677644010865999872/pu/img/zVHEMYnJKzq1SauT.jpg,1,Chihuahua,0.626236,True,Italian greyhound,0.128483,True,swing,0.0598404,False,
677565715327688705,NaN,NaN,2015-12-17 15:07:09,iPhone,Contortionist pup here. Inside pentagram. Clearly worships Satan. Known to slowly push fragile stuff off tables 6/10 https://t.co/EX9oR55VMe,https://twitter.com/dog_rates/status/677565715327688705/photo/1,6,10,,1349,487,140,https://pbs.twimg.com/media/CWcybBmWcAAigAQ.jpg,1,basset,0.397295,True,Welsh springer spaniel,0.199554,True,purse,0.105641,False,
677557565589463040,NaN,NaN,2015-12-17 14:34:46,iPhone,Reckless pupper here. Not even looking at road. Absolute menace. No regard for fellow pupper lives. 10/10 still cute https://t.co/96IBkOYB7j,https://twitter.com/dog_rates/status/677557565589463040/photo/1,10,10,,2548,1244,140,https://pbs.twimg.com/media/CWcrAVQWEAA6QMp.jpg,1,seat belt,0.27725700000000003,False,Shih-Tzu,0.249017,True,Pekinese,0.209213,True,pupper
677547928504967168,NaN,NaN,2015-12-17 13:56:29,iPhone,Not much to say here. I just think everyone needs to see this. 12/10 https://t.co/AGag0hFHpe,https://twitter.com/dog_rates/status/677547928504967168/photo/1,12,10,,7252,3889,92,https://pbs.twimg.com/media/CWciPonWEAUOqLD.jpg,1,American Staffordshire terrier,0.914978,True,Staffordshire bullterrier,0.08439529999999999,True,boxer,0.000461663,True,
677530072887205888,NaN,NaN,2015-12-17 12:45:31,iPhone,Say hello to Axel. He's a Black Chevy Pinot on wheels. 0 to 60 in 5.7 seconds (if downhill). 9/10 I call shotgun https://t.co/DKe9DBnnHE,https://twitter.com/dog_rates/status/677530072887205888/photo/1,9,10,Axel,1120,242,136,https://pbs.twimg.com/media/CWcSAI-WUAAOB9W.jpg,1,Staffordshire bullterrier,0.6892590000000001,True,Norwegian elkhound,0.026121,True,American Staffordshire terrier,0.0230747,True,
677334615166730240,NaN,NaN,2015-12-16 23:48:51,iPhone,This dog gave up mid jump. 9/10 https://t.co/KmMv3Y2zI8,"https://twitter.com/dog_rates/status/677334615166730240/photo/1,https://twitter.com/dog_rates/status/677334615166730240/photo/1",9,10,,1420,314,55,https://pbs.twimg.com/media/CWZgPPUWUAAUOvu.jpg,2,Lakeland terrier,0.859392,True,Airedale,0.0672917,True,Irish water spaniel,0.0495306,True,
677331501395156992,NaN,NaN,2015-12-16 23:36:28,iPhone,Meet Humphrey. He's a Northern Polyp Viagra. One ear works. Face stuck like that. Always surprised. 9/10 petable af https://t.co/FS7eJQM2F4,https://twitter.com/dog_rates/status/677331501395156992/photo/1,9,10,Humphrey,1138,253,139,https://pbs.twimg.com/media/CWZdaGxXAAAjGjb.jpg,1,beagle,0.313464,True,boxer,0.21850300000000006,True,French bulldog,0.106462,True,
677328882937298944,NaN,NaN,2015-12-16 23:26:04,iPhone,This is Derek. All the dogs adore Derek. He's a great guy. 10/10 really solid pup https://t.co/KgcsGNb61s,https://twitter.com/dog_rates/status/677328882937298944/photo/1,10,10,Derek,3796,1596,105,https://pbs.twimg.com/media/CWZbBlAUsAAjRg5.jpg,1,water buffalo,0.42425,False,kelpie,0.0290541,True,Staffordshire bullterrier,0.0284697,True,
677314812125323265,NaN,NaN,2015-12-16 22:30:09,iPhone,"Meet Tassy &amp; Bee. Tassy is pretty chill, but Bee is convinced the Ruffles are haunted. 10/10 &amp; 11/10 respectively https://t.co/fgORpmTN9C","https://twitter.com/dog_rates/status/677314812125323265/photo/1,https://twitter.com/dog_rates/status/677314812125323265/photo/1",10,10,Tassy,1716,574,145,https://pbs.twimg.com/media/CWZOOIUW4AAQrX_.jpg,2,Blenheim spaniel,0.924127,True,Japanese spaniel,0.0547901,True,Chihuahua,0.00820404,True,
677301033169788928,NaN,NaN,2015-12-16 21:35:24,iPhone,This is Juckson. He's totally on his way to a nascar race. 5/10 for Juckson https://t.co/IoLRvF0Kak,https://twitter.com/dog_rates/status/677301033169788928/photo/1,5,10,Juckson,1301,437,99,https://pbs.twimg.com/media/CWZBsjPWsAAZFFl.jpg,1,Japanese spaniel,0.6611779999999999,True,Pekinese,0.150119,True,Chihuahua,0.11972,True,
677269281705472000,NaN,NaN,2015-12-16 19:29:14,iPhone,This is the happiest pupper I've ever seen. 10/10 would trade lives with https://t.co/ep8ATEJwRb,https://twitter.com/dog_rates/status/677269281705472000/photo/1,10,10,,2085,753,96,https://pbs.twimg.com/media/CWYk0WxWoAAEwRt.jpg,1,Shetland sheepdog,0.656616,True,collie,0.195405,True,German shepherd,0.0131032,True,pupper
677187300187611136,NaN,NaN,2015-12-16 14:03:28,iPhone,Here we see a Byzantine Rigatoni. Very aerodynamic. No eyes. Actually not windy here they just look like that. 9/10 https://t.co/gzI0m6wXRo,https://twitter.com/dog_rates/status/677187300187611136/photo/1,9,10,,2856,985,139,https://pbs.twimg.com/media/CWXaQMBWcAAATDi.jpg,1,English setter,0.282396,True,Shih-Tzu,0.08411189999999999,True,Old English sheepdog,0.059538,True,
676975532580409345,NaN,NaN,2015-12-16 00:01:59,iPhone,This is Cooper. He doesn't know how cheese works. Likes the way it feels on his face. Cheeky tongue slip. 11/10 https://t.co/j1zczS0lI5,https://twitter.com/dog_rates/status/676975532580409345/photo/1,11,10,Cooper,2899,1143,135,https://pbs.twimg.com/media/CWUZpydWcAAeipD.jpg,1,malamute,0.363257,True,Siberian husky,0.245862,True,Eskimo dog,0.125547,True,
676957860086095872,NaN,NaN,2015-12-15 22:51:45,iPhone,10/10 I'd follow this dog into battle no questions asked https://t.co/ngTNXYQF0L,https://twitter.com/dog_rates/status/676957860086095872/video/1,10,10,,2311,862,80,https://pbs.twimg.com/ext_tw_video_thumb/676957802976419840/pu/img/dCj-qlXo73A5hf6Q.jpg,1,Labrador retriever,0.772423,True,beagle,0.055901699999999985,True,golden retriever,0.0311519,True,
676949632774234114,NaN,NaN,2015-12-15 22:19:04,iPhone,This is Tyrus. He's a Speckled Centennial Ticonderoga. Terrified of floating red ball. Nifty bandana. 8/10 v petable https://t.co/HqM3YhCaaa,https://twitter.com/dog_rates/status/676949632774234114/photo/1,8,10,Tyrus,1360,423,140,https://pbs.twimg.com/media/CWUCGMtWEAAjXnS.jpg,1,Welsh springer spaniel,0.206479,True,Saint Bernard,0.13933900000000002,True,boxer,0.114606,True,
676946864479084545,NaN,NaN,2015-12-15 22:08:04,iPhone,This pups goal was to get all four feet as close to each other as possible. Valiant effort 12/10 https://t.co/2mXALbgBTV,https://twitter.com/dog_rates/status/676946864479084545/photo/1,12,10,,1778,404,120,https://pbs.twimg.com/media/CWT_lOQWUAAXPaY.jpg,1,Pekinese,0.752707,True,golden retriever,0.055654599999999985,True,Great Pyrenees,0.041017800000000014,True,
676936541936185344,NaN,NaN,2015-12-15 21:27:03,iPhone,Here we see a rare pouched pupper. Ample storage space. Looks alert. Jumps at random. Kicked open that door. 8/10 https://t.co/mqvaxleHRz,https://twitter.com/dog_rates/status/676936541936185344/photo/1,8,10,,13263,5239,137,https://pbs.twimg.com/media/CWT2MUgWIAECWig.jpg,1,Chesapeake Bay retriever,0.5452859999999999,True,Norwegian elkhound,0.081482,True,space heater,0.0473911,False,pupper
676864501615042560,NaN,NaN,2015-12-15 16:40:47,iPhone,Meet Ash. He's just a head now. Lost his body during the Third Crusade. Still in good spirits. 10/10 would pet well https://t.co/NJj2uP0atK,https://twitter.com/dog_rates/status/676864501615042560/photo/1,10,10,Ash,2201,759,139,https://pbs.twimg.com/media/CWS0q8iU8AE2Srr.jpg,1,Chesapeake Bay retriever,0.371146,True,water buffalo,0.0995963,False,Weimaraner,0.0489679,True,
676821958043033607,NaN,NaN,2015-12-15 13:51:44,iPhone,Finally some constructive political change in this country. 11/10 https://t.co/mvQaETHVSb,"https://twitter.com/dog_rates/status/676821958043033607/photo/1,https://twitter.com/dog_rates/status/676821958043033607/photo/1",11,10,,24085,16654,89,https://pbs.twimg.com/media/CWSN-vaXAAA8Ehr.jpg,2,Great Pyrenees,0.8698040000000001,True,kuvasz,0.0798143,True,standard poodle,0.013263,True,
